{
  "schema_version": "1.0",
  "language": "ko",
  "updated_at": "2026-10-20T15:23:24Z",
  "source": {
    "sitemap": "https://aifrontier.kr/sitemap.xml",
    "llms_txt": "https://aifrontier.kr/llms.txt"
  },
  "episodes": [
    {
      "ep_id": 45,
      "url": "https://aifrontier.kr/ko/episodes/ep45",
      "title": "EP 45: AI 비즈니스 생존전략 — 어디에 AI 비즈니스를 세울 것인가?",
      "published_date": "2025-03-29",
      "status": "rendered",
      "content_hash": "89de1c1ab5de040644330d5a9bdbe392f17080d84767bca9bccd6eff89a2ba21",
      "last_seen": "2026-10-20",
      "extracted_hash": "89de1c1ab5de040644330d5a9bdbe392f17080d84767bca9bccd6eff89a2ba21"
    },
    {
      "ep_id": 75,
      "url": "https://aifrontier.kr/ko/episodes/ep75",
      "title": "EP 75: (수학 공식 없는) 강화 학습 이야기",
      "published_date": "2026-01-30",
      "status": "rendered",
      "content_hash": "43afca20ed5b74d51256be201b42d212d5ecfde3ff2b4fa1b7637b5bea716e73",
      "last_seen": "2026-10-20",
      "extracted_hash": "43afca20ed5b74d51256be201b42d212d5ecfde3ff2b4fa1b7637b5bea716e73"
    },
    {
      "ep_id": 76,
      "url": "https://aifrontier.kr/ko/episodes/ep76",
      "title": "EP 76: 교육과 AI: 한미유치원 설립자 최승준의 생각과 실천",
      "published_date": "2026-01-28",
      "status": "rendered",
      "content_hash": "069c74c7063a18b83fee214e9d64865c4c69e82219f6acfa5e86f1e276bbefff",
      "last_seen": "2026-10-20",
      "extracted_hash": "069c74c7063a18b83fee214e9d64865c4c69e82219f6acfa5e86f1e276bbefff"
    },
    {
      "ep_id": 77,
      "url": "https://aifrontier.kr/ko/episodes/ep77",
      "title": "EP 77: Gemini 3와 Antigravity: 너무도 가파른 변화의 곡선",
      "published_date": "2026-01-28",
      "status": "rendered",
      "content_hash": "5141350a0d678434d2f3a2b8b39b242243550168f5fa68b153c523491742c68b",
      "last_seen": "2026-10-20",
      "extracted_hash": "5141350a0d678434d2f3a2b8b39b242243550168f5fa68b153c523491742c68b"
    },
    {
      "ep_id": 78,
      "url": "https://aifrontier.kr/ko/episodes/ep78",
      "title": "EP 78: Ilya Sutskever의 설명",
      "published_date": "2026-01-28",
      "status": "rendered",
      "content_hash": "d1a080e1fa4a2e1034af05fac96169c1b64e182f5ed30bfa58048b80e3580ce0",
      "last_seen": "2026-10-20",
      "extracted_hash": "d1a080e1fa4a2e1034af05fac96169c1b64e182f5ed30bfa58048b80e3580ce0"
    },
    {
      "ep_id": 79,
      "url": "https://aifrontier.kr/ko/episodes/ep79",
      "title": "EP 79: AI Frontier 도망자 연합 회고 & GPT 5.2",
      "published_date": "2026-01-28",
      "status": "rendered",
      "content_hash": "1213f188a355fb6f34337c05af5e6754321415443f6bc8a69ee1e132a141a834",
      "last_seen": "2026-10-20",
      "extracted_hash": "1213f188a355fb6f34337c05af5e6754321415443f6bc8a69ee1e132a141a834"
    },
    {
      "ep_id": 80,
      "url": "https://aifrontier.kr/ko/episodes/ep80",
      "title": "EP 80: 2026년은 과학의 해가 될까? AI와 과학",
      "published_date": "2026-01-28",
      "status": "rendered",
      "content_hash": "69b819e8e8d89607b59532646c0fae18c9a663243ff931a0b7404b27e142c26f",
      "last_seen": "2026-10-20",
      "extracted_hash": "69b819e8e8d89607b59532646c0fae18c9a663243ff931a0b7404b27e142c26f"
    },
    {
      "ep_id": 81,
      "url": "https://aifrontier.kr/ko/episodes/ep81",
      "title": "EP 81: DeepSeek이 바꿔버린 모든 것: MoE와 RLVR, 2025년 AI 회고",
      "published_date": "2026-01-28",
      "status": "rendered",
      "content_hash": "8a83abee671ceca38954e4a6ba1d6fab0061aa8de8ddc7152bb1c421bce4aca2",
      "last_seen": "2026-10-20",
      "extracted_hash": "8a83abee671ceca38954e4a6ba1d6fab0061aa8de8ddc7152bb1c421bce4aca2"
    },
    {
      "ep_id": 82,
      "url": "https://aifrontier.kr/ko/episodes/ep82",
      "title": "EP 82: 원리를 생각하는 프롬프팅",
      "published_date": "2026-01-28",
      "status": "rendered",
      "content_hash": "87b81d856c2d72623e4258f5a4cf1a636fb08660c86292fec99910bb999ec54d",
      "last_seen": "2026-10-20",
      "extracted_hash": "87b81d856c2d72623e4258f5a4cf1a636fb08660c86292fec99910bb999ec54d"
    },
    {
      "ep_id": 83,
      "url": "https://aifrontier.kr/ko/episodes/ep83",
      "title": "EP 83: 이야기로 읽는 트랜스포머: 윤회하는 토큰의 순례",
      "published_date": "2026-01-28",
      "status": "rendered",
      "content_hash": "6e8e29455586f65bc66f7d5ca74f61eb6e43388c85b18b3f97e6ae323f26d35e",
      "last_seen": "2026-10-20",
      "extracted_hash": "6e8e29455586f65bc66f7d5ca74f61eb6e43388c85b18b3f97e6ae323f26d35e"
    },
    {
      "ep_id": 84,
      "url": "https://aifrontier.kr/ko/episodes/ep84",
      "title": "EP 84: Physical AI를 알아보자 (sudoremove 박종현 대표)",
      "published_date": "2026-02-11",
      "status": "rendered",
      "content_hash": "bf235e8ca092ef3257cc69f2740a78f4c37b5089913da967ab9f532c8f626f7c",
      "last_seen": "2026-10-20",
      "extracted_hash": "bf235e8ca092ef3257cc69f2740a78f4c37b5089913da967ab9f532c8f626f7c"
    },
    {
      "ep_id": 85,
      "url": "https://aifrontier.kr/ko/episodes/ep85",
      "title": "EP 85: OpenClaw와 2026년 2월의 신호들",
      "published_date": "2026-02-11",
      "status": "rendered",
      "content_hash": "62a0c428bfa2f753cd7d3d7775fc7fa5bb24a1c3f8d218ba1b0ebbef4c8d6090",
      "last_seen": "2026-10-20",
      "extracted_hash": "62a0c428bfa2f753cd7d3d7775fc7fa5bb24a1c3f8d218ba1b0ebbef4c8d6090"
    },
    {
      "ep_id": 86,
      "url": "https://aifrontier.kr/ko/episodes/ep86",
      "title": "EP 86: 진짜 내 일을 위한 Agentic Workflow",
      "published_date": "2026-02-18",
      "status": "rendered",
      "content_hash": "1a80b953b0117d54d151e58286f1be7ea610f4301d788244170556b66e50b559",
      "last_seen": "2026-10-20",
      "extracted_hash": "1a80b953b0117d54d151e58286f1be7ea610f4301d788244170556b66e50b559"
    },
    {
      "ep_id": 87,
      "url": "https://aifrontier.kr/ko/episodes/ep87",
      "title": "EP 87:",
      "published_date": "2026-02-24",
      "status": "rendered",
      "content_hash": "300cb6620840f2a95f4f788e1cb921a8bcbef7997164a67e90f33c95abf18bf7",
      "last_seen": "2026-10-20",
      "extracted_hash": "300cb6620840f2a95f4f788e1cb921a8bcbef7997164a67e90f33c95abf18bf7"
    },
    {
      "ep_id": 88,
      "url": "https://aifrontier.kr/ko/episodes/ep88",
      "title": "EP 88: 비결은 없다",
      "published_date": "2026-03-04",
      "status": "rendered",
      "content_hash": "3c6be95baf8011465815d0d4ce3b07615007f8e14c9718f00177e61b9b1fc017",
      "last_seen": "2026-10-20",
      "extracted_hash": "3c6be95baf8011465815d0d4ce3b07615007f8e14c9718f00177e61b9b1fc017"
    },
    {
      "ep_id": 89,
      "url": "https://aifrontier.kr/ko/episodes/ep89",
      "title": "EP 89: 딸깍과 덜컹",
      "published_date": "2026-03-15",
      "status": "rendered",
      "content_hash": "ecf78b015eebe4f4d8f95dcf1d92c66d3896ea481003ff54b8e2028f6256ab84",
      "last_seen": "2026-10-20",
      "extracted_hash": "ecf78b015eebe4f4d8f95dcf1d92c66d3896ea481003ff54b8e2028f6256ab84"
    },
    {
      "ep_id": 90,
      "url": "https://aifrontier.kr/ko/episodes/ep90",
      "title": "EP 90: 알파고 이후, 10년 (feat. HyperAccel 이진원 CTO)",
      "published_date": "2026-03-15",
      "status": "rendered",
      "content_hash": "2cb8f62168079f70ab8a33197986f078d7810c51fede1fb4f9f466798421a296",
      "last_seen": "2026-10-20",
      "extracted_hash": "2cb8f62168079f70ab8a33197986f078d7810c51fede1fb4f9f466798421a296"
    },
    {
      "ep_id": 91,
      "url": "https://aifrontier.kr/ko/episodes/ep91",
      "title": "EP 91: 26.1Q 비즈니스 관점에서의 AI",
      "published_date": "2026-03-21",
      "status": "rendered",
      "content_hash": "4233a8544f774e6281711c846e95427122ec184d7142312c8cde75dbde663b5f",
      "last_seen": "2026-10-20",
      "extracted_hash": "4233a8544f774e6281711c846e95427122ec184d7142312c8cde75dbde663b5f"
    },
    {
      "ep_id": 92,
      "url": "https://aifrontier.kr/ko/episodes/ep92",
      "title": "EP 92: EP 92. 루프를 닫아라",
      "published_date": "2026-03-29",
      "status": "rendered",
      "content_hash": "a8473e2e1bd65ad0413320f249452c6d4ca1f7dd99c13b52b5d55a19242bcf0d",
      "last_seen": "2026-10-20",
      "extracted_hash": "a8473e2e1bd65ad0413320f249452c6d4ca1f7dd99c13b52b5d55a19242bcf0d"
    },
    {
      "ep_id": 93,
      "url": "https://aifrontier.kr/ko/episodes/ep93",
      "title": "EP 93: Claude Code 소스코드 유출 이후",
      "published_date": "2026-04-07",
      "status": "rendered",
      "content_hash": "7c5cbce78d1a44fa4fc71cddc48942edeb2534d47275c78b921bc5bcc73257b3",
      "last_seen": "2026-10-20",
      "extracted_hash": "7c5cbce78d1a44fa4fc71cddc48942edeb2534d47275c78b921bc5bcc73257b3"
    },
    {
      "ep_id": 94,
      "url": "https://aifrontier.kr/ko/episodes/ep94",
      "title": "EP 94: Anthropic과 낮게 열린 과실들",
      "published_date": "2026-04-21",
      "status": "rendered",
      "content_hash": "17a566f55e29c9477a4a94c322e82e2126282cf42cf0f60cc2b3731483870364",
      "last_seen": "2026-10-20",
      "extracted_hash": "17a566f55e29c9477a4a94c322e82e2126282cf42cf0f60cc2b3731483870364"
    },
    {
      "ep_id": 95,
      "url": "https://aifrontier.kr/ko/episodes/ep95",
      "title": "EP 95: DeepSeek-V4 논문 읽기",
      "published_date": "2026-04-28",
      "status": "rendered",
      "content_hash": "6c8a6d2acac3502e2f91d73fa1a3c86cb073836339268fbeb1c243fc0cb9b0c8",
      "last_seen": "2026-10-20",
      "extracted_hash": "6c8a6d2acac3502e2f91d73fa1a3c86cb073836339268fbeb1c243fc0cb9b0c8"
    },
    {
      "ep_id": 96,
      "url": "https://aifrontier.kr/ko/episodes/ep96",
      "title": "EP 96: LLM 추론 인프라와 토큰 경제학",
      "published_date": "2026-05-08",
      "status": "rendered",
      "content_hash": "d84f115738a222c5f3cd912dbd4eef5a8a40788720ae23b940266259ae37c480",
      "last_seen": "2026-10-20",
      "extracted_hash": "d84f115738a222c5f3cd912dbd4eef5a8a40788720ae23b940266259ae37c480"
    },
    {
      "ep_id": 97,
      "url": "https://aifrontier.kr/ko/episodes/ep97",
      "title": "EP 97: AI Psychosis 시대의 사람들",
      "published_date": "2026-05-21",
      "status": "rendered",